,title,rating,date_of_stay,review,resort_name
639,Great Value Hotel!,40,October 2014,We arrived later than expected to Pelangi Hotel and were greeted by very friendly staff. During the booking process we said we may want to upgrade so upon arrival the staff offered for the two of us to be shown both rooms to make our decision. We ended up staying with original Superior room as we did not see much advantage for us staying in the Deluxe room. The hotel is situated right on the beach and only a short walk to shops and restaurants. The pool was amazing overlooking the beach and the staff were extremely friendly making it a wonderful experience to stay here. Will highly recommend!,Pelangi Bali Hotel
640,A definite sense of home at the Pelangi,40,October 2014,"I had a great experience at the Pelangi! The staff here are beyond helpful and accommodating. After a day or two, they knew me by name which I felt was amazing considering the plethora of guests staying at the hotel! Unfortunately I was sick for two days whilst staying there however the staff went above and beyond to ensure I was comfortable (this included ordering doctors visits, and even checking in on me). It is also worth mentioning that after visiting an Apotek/Clinic and leaving my mobile phone there, one staff member drove there, picked it up and delivered it back to my room - free of charge.
A lot of reviews mention the lack of privacy on the ground floor - for me this was not an issue and provided as sense of homeliness.
The pool here is fantastic and suited to all (very kid friendly) and the location is amazing - just a short walk up the road to the Bintang Supermarket and the main strip of shops, and literally on the beach.
I have two minor negatives: the food here is slightly overpriced in my opinion for what it is and the room I stayed in had very little natural light.
Nevertheless, I stayed in three places in Seminyak and this was a definite favourite - I would recommend the Pelangi to the younger traveler as this felt like a bit of a 'party' hotel with guests taking full advantage of the swim-up bar! (not necessarily a negative).",Pelangi Bali Hotel
641,Lovely Hotel,50,September 2014,"I stayed at this Hotel for two nights in September; it was the first Hotel that my Mom and I checked into at the beginning of our Holiday in Bali, after a long 20 hours of travelling from South Africa we were ready to just relax. It was absolutely lovely, the staff were super friendly, the reception was welcoming and our check-in went very smoothly. The room was clean and spacious for the two of us. Wi-Fi wasn't too great throughout the Hotel but that wasn't a problem for us, we were still able to get hold of our loved ones to let them know that we arrived safely.

I am sad to say that I only made use of the swimming pool on the one night after a long day out exploring because their swimming pool was amazing.

The Hotel is located away from the shops and busy area, but not so far that you can't walk there in the evenings or during the day. We never felt unsafe. It is located right on the beach front, which we only really discovered on the second night. If you stay there you just have to go sit and watch a sunset and experience the bean bags all along the beach.

I loved staying in Seminyak and would definitely return to Pelangi Bali if I were to travel to Bali again.",Pelangi Bali Hotel
642,Reality meets illusion,40,September 2014,"Am already recommending the hotel. Room on the ground floor, would get top floor next time, just easier with luggage when leaving. Room was neat, clean & airconditioned - ne issues. Pool & breakfast area just as pictured. Could get a sun lounge by the beach front to watch the world go by..watch tourists learn to surf, hawkers working their trade, people walking by...nice change to just looking at hotel area. Good view from any of the sun lounges, always somewhere in the shade for us. Breakfast more than enough to keep us going all day & nice to watch the early morning beach scene. Walking distance to restaurants & shops either through beach front or hotel front. Staff friendly, fellow guests relaxed, common opinion was Pelangi was truly relaxing.",Pelangi Bali Hotel
643,Think twice before paying for what isnt worth it!!,20,September 2014,"My partner and I stayed at the Pelangi 5 days, and it wasnt worth for $120 per night for a superior room, i would pay for those type of rooms up to $70 as there was mosquitos, the toilet was blocked couple of times, there was issues with the plumbing which we had to notify reception to get it fix, the bed is so uncomfortable, they had the same breakfast menu 4 days in the row.

Transportation if you are new to Bali, you better off catching a taxi at the airport as Pelangi would rip you off if they send a tax driver to pick you up which you be paying to them $35 US. The taxi would only cost you from the airport $15 US to Pelangi .

The location is perfect if you want to be near the beach either than that there wasnt anything good about it. People are very friendly and you can't swim in seminyak as the water is too raft, it would be recommendable to stay in Noosa Dua.",Pelangi Bali Hotel
644,Great location,40,September 2014,Comfortable and friendly. We have stayed at the Pelangi a few times and have always been happy with it. Perfectly located with lots of food and bar options nearby. Lovely to walk to Kuta along the beach.,Pelangi Bali Hotel
645,Very good service,40,September 2014,"We spent 4 nights at the hotel, clearly the location is wonderful.
The service is very good, the breakfast decent the rooms are clean.
Overall the hotel looks a bit tired specially in the evening it seems sleepy.
The beach is a stone throw and is wonderful with nice bars.
The wifi is not very good.
Overall we had a very good stay at this property.",Pelangi Bali Hotel
646,2012 holiday,40,October 2013,"The Pelangi Hotel at Seminyak is a very nice hotel, just walk onto sandy beach out of the rear of the hotel, rooms are clean and spacious serviced daily, friendly staff, a good buffet breakfast which I can recommend, Seminyak is close to all Bali attractions only a Taxi ride or you can walk the beach path to Kuta. Trips to all Bali attractions can be organized from the Hotel with pick up and drop off at the Hotel foyer. The perfect stray to unwind or enjoy the wonderful sights of Bali.",Pelangi Bali Hotel
647,A Disappointing Experience,20,September 2014,"We have stayed at the Pelangi 5 times. We are a family of 5. 3 teenage adults and 2 parents. Each time we stay we book 2 rooms (we have stayed in all the room combinations). The rooms are reasonably priced (well I considered this to be the case in the past). This time we decided to book a superior deluxe room the difference between the deluxe and superior delux is a total waste of money (don't go beyond the deluxe). The room is only bigger because of the spa bath and 3 of the 4 are downstairs (on the major path to the beach and pool. Noisey and no privacy). Sitting in the out door area of the downstairs rooms you have no privacy at all, in fact you could almost pass a drink to your neighbours or anyone heading to the beach or pool without getting out of you chair. My perception is that the hotel is begining to deteriorate,  in our superior delux room we only had one bedside table the fridge was noisy and the aircon average at best, the sheets and towels whilst clean are overdue for replacement. Wifi was very poor and the hotel is just looking a bit tired.  On the upside the staff are as pleasant as ever and the rooms are clean.
     The location of the resort clearly hasn't changed but the area has deteriorated markedly in the last 12 months. A large warrung has been built out the front of the hotel obscuring 25% of the beach view. It looks like Kuta has finally arrived on the outskirts of Seminyak with the Drunken untidy Aussies marching along the road out the front (which is now busy). The beach is awash with bean bags and wanky bars. South of the hotel and you might as well be in Kuta, north of the hotel and the beach remains largely untouched.
     Many may find my review a little picky and I would understand why, however, our experience of the Pelangi this year is a total contrast to last year or any othe other 4 preceeding stays. The change probably mostly to do with the tiredness of the hotel and the change in the area. With the new emerging short term Villa availability I now cosider the Pelangi only average value and would suggest there is much better value accommodation available. The hotel is becoming a bit like The Bounty Hotel (for those that are familiar with the Kuta Icon).
     Its further north or to the islands for us next time too many white wankers not enough good old fashioned Bali fun. But if you want a great fun cheap drinking holiday on the beach and dont care where you are in the world the Pelangi would work, try and get a deal as the full rate is over the top. Or look for a Villa.",Pelangi Bali Hotel
648,Great Start,40,September 2014,"This was our first stay on Bali and the staff are super friendly. Nicely situated to shops and beach, especially to the ""restaurants with the bean bags on the beach"" the room was average but adequate. Breakfast was average. I would stay here again",Pelangi Bali Hotel
649,value for money with beach front,40,September 2014,"This is our second time at Pelangi seminyak. A long skinny hotel with absolute beach front location. Great pool and the obligatory swim up pool bar with views out to sea - just lovely
It's an older hotel which shows its age in places with the smaller rooms etc. But the trade off is the lower price combined with the awesome beach location and access to all the hip restaurants and bars. We opted for the larger deluxe room which just gave us that extra room to move & we weren't sorry. Wouldn't go back to the standard room.
The staff are very friendly, happy and helpful.
Highlights of our stay-
Eating well :
12 course degustation at Menjakawi at Ke de Ta - just fantastic.
Potato head for lunch. Big fat juicy burger.
Cheaper but still great :
La Plancha - little tapas shack right on the beach almost directly in front of the pelangi (just to the left). Phenomenal food. Puts all the other little eat shacks to shame.
Lucky Day - Sports bar arrangement with delicious good portioned food
Not so good :
The sausage meals at The Bush Telegraph - what are they thinking? Just awful.
Smoking - arrggh it's just everywhere. Funnily enough, not an issue at ku de ta or potato head.",Pelangi Bali Hotel
650,Great Location,50,September 2014,"We usually stay at Legian so this is our first time we have stayed at Seminyak. Our choice to stay at the Pelangi was for 2 reasons, the location and the great value for money. Although this is an older style resort, it made no difference to the comfort and size of the room. We chose a larger room which was more like a small unit. The staff were more than helpful and could not do enough to help with anything you require. The bell hop staff were the most amazing, especially Wayan and Dex, they always greeted us with a huge smile and were extremely cheerful every time they greeted us. My wife and I would definitely stay here again and recommend it highly to all who are looking for a great resort in a fantastic location.",Pelangi Bali Hotel
651,best 1st experience,50,October 2013,"As this was my 1st time traveling to bali, i couldnt of ask for a better stay!
every problem we had was quickly resolved (just bedding issues). the staff were very helpful and always remembered your name and asked how your day was!.
they were such a pleasure, as never travel to bali before, i was unsure about certin things, and the staff helped and assisted with my questions.
the room was very clean and the daily room cleaning was perfect!, toilet paper, and towels were replaced daily as well as new bottle of water in the room.

The breakfast was quite average, if you didnt get there with in the 1st hour or so all the good items were etiher gone, or had to cold and hard.
the egg station was great!, always remembered your order from the day before!.

over all it was a pleasure and i have now rebooked back to bali, as this was a great pleasure of a experience!",Pelangi Bali Hotel
652,Nice hotel & right on the beach,40,September 2014,"Older style of hotel, but good service, friendly staff and everything you need just around the corner or on the beach within couple metres.
And all of this in the heart of Seminyak.
Highly recommended.",Pelangi Bali Hotel
653,Amazing Location,40,September 2014,"My sister and I just spent 8 nights at the Pelangi. At first I was a little disappointed by the room ""balcony"" is very very small. But by the first day I was more than happy. We transferred to a ground floor room which was much better. LOCATION of this hotel is unbelievable. I had a list of places I wanted to go and everything was within easy walking distance.
The pool was sensational with a view of the beach. The food was great. Not the best Bali breakfast I've had but the staff were great and it was everything we needed.
Staff were a little slow if we wanted to order food and drinks by the pool so we had to go up and order.
Would I stay here again? Absolutely. Very very good value for money and it was quiet as well considering the location.",Pelangi Bali Hotel
654,Not what we expected for Bali on the beach,30,September 2014,"decent size room with a balcony that faces your neighbor across the small alleyway. Toilet didn't work, had to call several times. The beach area is just ok. Safe during daytime but seedy after sunset. Dangerous with so much motorcycle traffic speeding by 2 inches from you. The bar is typical for Asia..they can make some very common drinks but dont expect a good martini or even a good bloody mary. We wouldnt try this area again. Far too much traffic that encroaches on your personal space. Breakfast is pretty good.",Pelangi Bali Hotel
655,"Pelangi Hotel & Spa, Seminyak",40,August 2014,"Great family holiday on the beach. Recommend for families or individuals who that love the beach, surfing, eating out, great restaurants near buy, great shopping etc. This is an older style hotel but it's rating reflects it's clean and comfortable rooms, good service and hospitality.",Pelangi Bali Hotel
656,Excellent Location with Great Staff,40,August 2014,"I visit Bali twice a year, one being a boys trip ( to put it in context we are mixed from mid 20's to 50's) and the other with my wife. This time was the boys trip with a mates 50th and the second time we have stayed here.

The hotel is right on the beach and centrally in the extremely popular Seminyak area. It does not have the large grassed, palm tree pool area some people maybe looking for with a smaller paved beachfront area facing the beach.

However the beach is straight out the front and is home to 6 to 7 little bars which are very popular for drinks and a light meal and is the main spot to be when the sun is setting sitting in a bean bag with a drink in hand. One of the must dos when in Bali. The water can be very strong but if you are a good swimmer it is one of the best places to swim along the stretch from Kuta to Seminyak.

The staff as always are very very friendly with some remembering us from our last trip in 2011. The rooms are typical of this style and age of hotel in Bali. Not luxurious but spacious and very clean. Breakfast was good with a good choice and always easy to find a seat which was a requirement wi 9 guys sitting together.

The location provides excellent access to restaurants, bars and shops without having to look for a taxi.

Summary, excellent location, very friendly staff and very good value for money and we will be back.",Pelangi Bali Hotel
657,Beachfront relaxation,40,May 2014,"I had a great stay here with my family in May 2014. Unfortunate our stay was just for 2 nights but we made a good choice with Pelangi. It's on the beach and right in the heart of Seminyak. The restaurant where they serve breakfast overlooks the beach.

Didnt get to use the pool and poolside bar but it looked quite inviting.

Overall great experience. Would definitely stay here again.",Pelangi Bali Hotel
658,Great Location next to the ocean!,40,August 2014,"Pelangi is a rather nice hotel, clean and spacious enough! we had a deluxe room and it was quite big with all the facilities! positives: great pool, great location, nice beach bars just in front of the hotel, nice staff! negatives: the balcony was seeing in the corridor which lead to the pool so we did not have privacy i would prefer a room in the 1st floor! expensive and mediocre spa!",Pelangi Bali Hotel
659,Disappointed,20,August 2014,"Good location . The rooms are clean but very dated, especially the bathrooms. Disappointed that the Roof Top area is not used anymore (perhaps the photos should be removed fro the web site). The breakfast was the poorest we have ever had as the food was cold ., Will not stay here again",Pelangi Bali Hotel
660,"Great Place, Great Staff.",40,August 2014,"We were looking for somewhere to go for my partners 50th birthday and a few friends said that that would join us on the trip. We looked at another place but our friends thought that it was out of their price range ad decided to stay at the Pelangi as they had enjoyed it on previous occasions. So we opted to join them at the Pelangi. Upon arrival we were greeted, with what we now know as true Balinese hospitality, the bell boy unloaded suit luggage from the car and showed us to reception and checked us in. We were shown to our room a super Deluxe suit. The room was spacious and very clean, and the air conditioner worked a charm and the room was very cool. If you can request a room ask for one close to the pool, and restaurant. Our friends had superior rooms which were small but comfortable but room size really isn't an issue if your on the ground floor as you can sit out in the well groomed garden just outside your door. The upstair rooms have a small balcony with only room for one person. But then again your on holiday and you wouldn't travel all that way to sit in your room. Most of the day was spent travelling and seeing the sights, but make sure you get a good driver, we used Subadi Nyoman - Bali Private Day Tours see my review, or sitting by the pool. The pool lounges fill quickly and people get up early and claim the best ""Real Estate"" and then go back to their rooms. There is singe that says ""unattended towels will be removed after 1 hours"" yes ""hours"", but we didn't see this happen but if you watched and obviously nobody was using it it was a problem if you took it. The staff at the Pelangi were all lovely and it wasn't long and they were all calling us by name. The Pelangi has beach frontage and several beach Restaurants close by on the beach. The days that we were't sight seeing we had lunch and dinner at one of these. Be careful when stepping out onto the path/road as it used by people on scooters, and there is there ever present beach hawker trying to seek you another watch, belt, pair of sunnies, or even a massage, but leave you well alone once in the resort. In all the Pelangi was a great place, it's clean and tidy, although a little tired, but if you look past this and enjoy the people and culture you'll have a great time. Oh and the staff are truly beautiful and grateful and will look after your requests without fuss. They even put cake in the fridge for my partners birthday and put a floral arrangement on the bed to mark the occasion.",Pelangi Bali Hotel
661,Very good hotel,40,September 2014,"Everything was really nice.
Clean rooms and towels, very good service and friendly stuff all the time. Also the breakfast buffet was good and delicious.
The spa is very relaxing and they do really good.
The hotel is almost at the beach (1min). Over there is a nice restaurant where you can get a nice lunch with a beautiful view for less money.",Pelangi Bali Hotel
662,Beautiful staff great location,50,August 2014,Amazing experience the staff went out of their way for any of our needs.. greay value right on the beach will be staying again and recommending to friends. Amazing buffet breakfast selection which changed daily and beautiful sunset views.. we just left and already cant wait to go back,Pelangi Bali Hotel
663,"Top location, will stay again!",40,July 2014,"This was my 2nd time to Bali when we stayed at the Pelangi in Seminyak. Previously we stayed in Seminyak on our first trip but the location of the place we stayed was no where near as good.

We really enjoyed the Pelangi and will stay again. The location is amaizing, you can be sitting by the pool and watching the beach. A few steps away (literally) is the beach. In the day you walk up and down the beach, plenty of funky places to get coffee and really yummy food. Night time gets even better on the beach, bean bags, live music, cheap food and alcohol, lanterns, fire works..etc. we loved it so much we went to the beach every night!

The breakfast at the Palangi is really good, all you can eat!
The pool is really clean and beautiful. Staff are very friendly and nice. Food and cocktails by the pool is perfect.
Rooms are good, obviously not 5 star but hubby and I were happy with them.

Day spa is good. Gym is average with most machines not working, but we still used it and were happy to have a space to work out and played music via our phones and wifi!

Overall, I enjoyed me stay and would stay again.",Pelangi Bali Hotel
664,Holiday in bali,40,July 2014,"It was our 30 th wedding anniversary ,we had a great time and nothing was a problem, great staff and friendly ,couldn't fault anything , if you needed anything in your room Thay where there straight away, we will go back again ,thanks very much to you all at pelangi Anna and John",Pelangi Bali Hotel
665,"2nd. time, and we will be back!!!",50,August 2014,"Oh, what isn't there to like about the Pelangi? The staff are all amazing, and even remembered us from last year. They all go out of their way to help you with anything you might need.
The rooms are large and comfortable and cleaned well each day. We like the deluxe rooms but the superior rooms are good as well.
The buffet breakfast is perfect, if you complain about that, you must be very fussy. It's better than last year, and I thought it was great then too.
They have everything you could possibly want, from egg station, to cereals, fruits, hot dishes, bacon and sausages, toast, bread, croissants, and Danish pastries, and must not forget the pancakes.
The pool is outstanding, and lounges are plentiful, some overlooking the beach.
Just outside, there are plenty of warungs, such as Bali Juice Park, which is my favourite, and have a few Bintangs with Daywa or Froggy in the afternoon. Too much to mention, but this hotel is in a prime position for relaxation, entertainment, beach, restaurants and shopping...and amazing sunsets!!!",Pelangi Bali Hotel
666,Nice place to stay,30,August 2014,"Friendly Staff, clean rooms, nice pool area, best breakfast I have had in a Bali hotel. Only negatives were toilets were an issue, standard rooms were a little small but easily bearable, Pool bar opened way too late.",Pelangi Bali Hotel
667,It all about Location,40,August 2014,"it was first time to Bali and i Traveled with my mummy and they made sure we had a bed each and didn't share one as my mum a snores. They were a full house with a wedding party/family guests. Not sure what to expect but the hotel is good and always keep clean which is a great thing. the pool is great. The one Bone i have to Pick is the Sunbeds around the Pool. if you go out for the afternoon its only Far the you FREE UP THE SEAT FOR SOMEONE ELSE STOP BEING SO SELFISH. I love the choice of Breakfast it was great. the in-house menu for dinner and room service was not that great but with the choice you have out on the beach why would you eat in the hotel for main meals.
the swim up bar is good it get stocked up everyday and the Prices are cheap to for in-house. my mum and i wanted a massage but did want it on the beach so we had one in the hotel and the girls were so great made the massage relaxing and enjoyable. A big cheers to the girls in the in-house Spa loved the time and effort.",Pelangi Bali Hotel
668,Brilliant location,50,August 2014,"Have stayed here a few times,great location if you love the beach .
Lots of quaint restaurants along the beach ,and awesome view of sunset.
Hotel is clean ,rooms are large,staff very good .
Downside not enough pool chairs ,and lots of steps to reception.",Pelangi Bali Hotel
669,"clean, tidy but access to hotel facilities limited",30,August 2014,"Great location, had a super deluxe room which was spacious, clean and comfortable. Great access to the beach especially for 'sundowners'. The hotel despite its beachfront location did not take advantage of this - there is a Sunset Terrace on top of the restaurant which would be prime sunset viewing cocktails and snacks, we were very disappointed when told by hotel staff we could only access this if we booked a private function. Also the restaurant offered a very pedestrian menu for lunch and dinner. Overall there was poor access to the sun lounges around the pool and those facing the beach front. There are not enough for all guests, and also there were some guests who would 'save' them from day to day - we had to hire on the beach as there was very little option. On the whole the hotel staff were helpful and friendly",Pelangi Bali Hotel
