,title,rating,date_of_stay,review,resort_name
957,Excellent Value and great beachfront location,50,July 2012,"We had a great stay at the Pelangi for 10 days, the staff are so welcoming and friendly. Our room was always clean, a/c worked well and free wifi was a bonus!! The pool area was really nice and overlooks the beach, we could always get a sun lounge. The gardens are very well maintained, drinks by the pool aren't so cheap but I guess tha'ts most hotels. The location is terrific, step straight onto beach where there's heaps of restaurants, live music and beanbags on beach at night. Look for Sumi for a $6 hour long massage,she was great!! The resort has a free shuttle bus into Kuta every day which we used to go shopping. Any time you ask the staff questions they are so helpful, my daughter got sick there and within 2 minutes of calling reception they were at our room with fresh towels for her. I would definitely stay here again, agree with other reviewers it is a 3 star hotel doesn't pretend to be 5 star.",Pelangi Bali Hotel
958,Friendly staff yet again but hotel needs another refresh.,40,June 2012,"This was our 2nd visit to the Pelangi in just under 2 years...yes I will agree with a previous reviewer and say that the hotel lacks a little atmosphere like funky music at the pool bar overridden by balinese music from the restaurant..but compared to many of the other hotels you get what you pay for and the location on the beach was a highlight for us. This was our 7th visit to Bali and we did find overall no matter where you go the prices have definitely gone up..this hotel is let's not forget 3 star..however if we had any requests they were met straight away.I have stayed at many a 5 star hotel for my work and I am a bit of a 5 star girl but the price of accomodation in Bali is getting rediculous so the Pelangi worked for us again this time for us. Also expect 3 star and i guess you will not be too disappointed.....

Again we had a super deluxe room and two single rollaways were provided at no extra cost for my 2 kids...there are no hidden charges in night rates as all taxes are included. A plus!

I was disappointed the sunset terrace was not open for dinner as we spent a few nights here on our last visit. I also agree management need to keep up with the reviews on this site. The staff always greeted us at breakfast and front reception loved to come out from the desk to play with my daughter..the Grandmas hotel up the road has a fabulous day spa..I have to say that the locals and a lovely guy Ormond who loves my kids made me come back to this hotel but I will say I think I may save a little harder and try 4 star next time for that little bit of extra wow...",Pelangi Bali Hotel
959,Just like coming home!,50,July 2012,"After 20 days travelling through Sumatra and Java the Pelangi was indeed a site for sore eyes. We had stayed here about 18 months ago and to our great surprise many of the staff remembered us and we got a very hearty welcome. We were amazed that after a year and a half and countless guests that they could still offer such a personal and friendly service. If Bali is the friendliest island in the world, then the Pelangi is the friendliest hotel in Bali.

Aside from the wonderfully personal service, this is a great hotel. Clean, well appointed rooms, prompt service, great facilities, amazing location, good food- you couldn't want for more.",Pelangi Bali Hotel
960,"Great Pool, Cocktails, Food & close to everything!",40,June 2012,"In my opinion Pelangi's location definately makes it worth staying there! There is a private beach entrance, a bin tang supermarket just up the road a bit, close to Seminyak Square (A little too far to walk - Might as well ctach a taxi for $3 or $4 AUD) Also across the road to the front of the hotel is a taxi service. Reasonable and easy to haggle with if you want to.
We had a standard room. It was a decent size for us. We didnt spend a HUGE amount of time in there. However we had not terrace or balcony. Only a back door which led out to a garden walk way. He had to move two single beds together - i dont know if this is every standard room bed style or if you need to specially request double beds. The walls were also very thin. At times it was annoying, but you could live with it. On the last couple of days the bathroom smelt awful - i think it was the plumbing.
The Pool is AMAZING. We loved being there. The swim up bar definately made our holiday as well. Good prices and friendly staff. We also order bar snacks which were so cheap and great. we had a meal there on BBQ buffet night - AWESOME food!
The beach entrance made our holiday. there was no busy walk to reach the beach and you coudl come and go as you please. There are SOO many bars and resturants up the beach if you want ot find something just go via the beach.
Their sunset terrace is never open. apparently only open for functions. but you are still able to go upstairs and take photos or view the susnet.
Buffet breakfast was nice we ate there nrealy every morning. Egg station was great!
Spa wayyy too expensive for Bali. But maybe that's just my opinion. No safe's in room but they have a safe room by the 24 hour reception which was very secure.
To use their computer and internet was expensive.
I woudl stay there again just because of their excellent location, but woul upgrade our room.",Pelangi Bali Hotel
961,Pelangi Management should really get on here to respond to some of these reviews.,40,July 2011,"We are a group heading to Pelangi in a weeks time as always i keep an eye on reviews before i book and then the lead up to arrival. Pelangi would have to have the most mixed reviews ive ever read. If only Management would respond to some of these, it could possibly make things a whole lot clearer.
Well will give my review once we are there. :-)). Please note to apply this post i have given a 4 star to all questions as we actually have not stayed as yet",Pelangi Bali Hotel
962,Best hotel value in Seminyak,50,May 2012,"One of the few hotels that are ""right on"" the beach (no road to cross) with exceptional friendly staff throughout the resort. The infinity pool is maintained to a high standard as are the grounds and rooms. The hotel is centrally located to a terrific range of restaurants & shops. There are 5 Warungs on the beach within a minute or two walk that have beanbags on the beach and live music every night. We are going back for our 16th stay at the hotel in September. Come join us.
Bob",Pelangi Bali Hotel
963,"""Wooooooooooooo Do NOT go in there"" !",10,June 2012,"by far the worst hotel I have ever stayed in.

I will put this in dot form to make it easier to read:

1. Walking to our Seperior room. The rails on the steep stair cases were too unstable to hold on to. If you are needing the rails for support to walk up and down stairs, forget it as they would probably collaspse and are extremley dangerous.

2. Requested a room with Twin Beds. Was given a room with one bed.

3. Room was absolutely filthy. Dirty floors, dirty bath, used tampon in the tiolet.

4. The bathroom smelt very strongly of sewrage. Foul.

5. Restraunt is VERY expensive in comparison to most in Bali. $5 for a coke.

6. The pool closed at 7pm even though we were told over the phone before booking that it closed at 11pm. What a joke.

7. When we checked out I advised of the filthy condition of the room, they didnt even apologise.

Will not return EVER !",Pelangi Bali Hotel
964,absolutely disgusting,10,June 2012,"this hotel ruined my birthday as we had spent the three days before in saba in a beautiful villa where we made friends with all the staff they made us feel like royalty, they drove us anywhere and nothing was a trouble, we understood that a hotel would be much more different so when we checked in we thought at first it wasnt too bad, got to our room after several flights of stairs and a long walk down the tunnel of doom, got into our room and it was putried. we asked for twin beds got one. the room smelt like the sewerage and the bathroom was absolutely gross, we washed our feet and by the time we walked from the bathroom to the bed our feet were black, there were no bottle openers in the room so we couldnt even drink the complimentry water as it needed a bottle opener, the website said pool bar was open til eleven but at 7pm we were not allowed in. on check out we got no assistance and had to lug our bags down three flights of stair. the rooms there are absolutely dirty and gross. The food is expensive we ordered potato wedges and for 100 000rupiah got 5 wedges thats it. i wouldnt even recommend this to my my enemies and certainly dont feel safe in this hotel.",Pelangi Bali Hotel
965,theres nothing to fault at the pelangi,50,June 2012,"Just returned from 10 days at the pelangi and could'nt find any faults the rooms are a good size and cleaned every day fresh bedding and towels water in your room every day there are always sun beds available and pool towels provided the breakfast was ok always found something to eat the station was ok
The hotel is right on the beach just outside the hotel you will find sumi doing massages only cost 50.000 rupiah for over a hour i went three times it was,so relaxing
There are plenty bars n resturants just a short walk we went to cocoon for cocktails but found it quite pricey being from england we thought 28 english pounds was,a lot for four cocktails wen we can four at home for half the price but were on holiday and they were lovely so try n not think about the price n just enjoy your selfs
Went to waterbom park its a brill day out even if you dont ave kids like us but we ad a great time
If you want a nice resturant in a lovely setting try poppies in kuta you wont be disapointed
Will be back in bali next year and wouldnt hesitate to stay here again",Pelangi Bali Hotel
966,Not what I expected,20,June 2012,"Had a great time with family and friends, but would not stay at this hotel again. Very expensive, no atmosphere, the hotel needs a lot of maintenance and updating. Staff friendly. Anyone can use the pool from the beach. No security. Very disappointed with this hotel.",Pelangi Bali Hotel
967,Pelangi Hotel - fourth visit to Bali,40,April 2012,"Recently stayed at Pelangi Bali Hotel, good location and breakfast, staff very helpful.
Best benefit hotel is close to beach front. Very clean rooms!",Pelangi Bali Hotel
968,Pelangi Hotel,40,April 2012,"The staff at the hotel where fantastic and bent over backwards to make your stay memorable. Great location - beach front and a stroll to markets, shops and fine restaurants",Pelangi Bali Hotel
969,Most friendly & welcoming staff,40,May 2012,"We stayed here for 6 nights, we loved it. Great location right on the beach, beautiful pool, nice tidy rooms, and the most friendliest staff. Nothing bad you can really say about this place, although the food wasn't that great but there are plenty of restaurants only a short walk nearby.",Pelangi Bali Hotel
970,"Don't ask for them to organise a taxi when you leave, it won't happen!",30,May 2012,"Stayed at Pelangi for 5 days, hotel was bigger than I thought, pool was gorgeous and overlooked the beach, bintangs were expensive - cheaper to go to all the cool little beach bar/restaurants just outside dotted along the beach.

Staff were friendly, and we basically only slept there, when we went to leave the guy at the transport/taxi desk wouldn't organise a taxi, said we had to wander out on the street with our cases and get our own. After just staying at the Puri Raja where they raced out to the street to flag us a taxi while we waited with suitcases, this small detail has put us off staying at Pelangi again.",Pelangi Bali Hotel
971,Great location on the beach at Seminyak,40,May 2012,"Positives:
1. Location - Pelangi is well located on the beach at Seminyak. Walk out of the front of the resort and you are on the beach. It is also enjoyable to eat breakfast looking over the seaside and watching the sunsets over the water.

Pelangi is a short walk from local restaurants, shops and the Bintang supermarket.

2. Pool - Pelangi has a superb pool with a swim-up bar.

3. Value - Very clean and comfortable accommodation. We found our room to be very quiet too.

4. Friendly and attentive staff. Overall, the service is very good.

Where it could be improved:

1. Extend wireless internet access to rooms. At time of writing, wireless internet access is only available at the restaurant and around the pool area. While this is sufficient for most needs, I would prefer to leave my computer in my room.

Breakfast was very nice and included fruit juices, tea and coffee, breakfast cereals and muesli, local and international breakfast options. I enjoyed the omelets cooked freshly to order.

Overall I was pleasantly surprised. Pelangi exceeded my expectations, probably because I was not expecting this level of quality for the price.

If you are looking to get away from the hustle and bustle of Seminyak and want a good value for money hotel with an A1 position, then I have no hesitation in recommending the Pelangi Bali Hotel.",Pelangi Bali Hotel
972,Great return stay,40,May 2012,"The service is always friendly, welcoming and we were made felt special each day. We stayed 2 weeks and wish it had of been longer. Hello to Wayan at the front desk, always had a smile and greeted us each day. The only thing that lets Pelangi down is the restaurant, there are so many better places to eat just near by and cheaper also.",Pelangi Bali Hotel
973,Good Value - Basic Clean Room - Excellent Location Hotel,40,March 2012,"For the price this hotel is good value. It is a 3* hotel in an excellent location - it is on the beach at Seminyak. It provides clean basic accomodation for around $100 (AUD) within very easy reach (walking or short taxi ride) of excellent shopping, recreation (ie the beach), restaurants, etc. The staff are fine. This is a 3* hotel - it does not pretend to be 5* hotel. There is no safety deposit box in the room (its at reception), it is a simple breakfast which may be fine but if you want something a little bit better for $5 walk down to Zanzibar on the beach a few hundred meters away. The bathroom is one with a shower screen which will drive you crazy after a while,
This hotel (room) was good value - it was clean and in a good location - I would stay there again !",Pelangi Bali Hotel
974,Beachfront bliss,40,May 2012,"The service here is so friendly, helpful and welcoming, it was sad to say goodbye to them! The beachfront location was perfect for us, and the 10 minute walk to the main street was interesting and easy.There are lots of restaurants, bars and shops very nearby, and a free shuttle or cheap taxi ride will get you to the main street if you want. We were a group of 3 in the suite - which was gorgeous.It has 2 huge rooms,a large balcony overlooking the pool and beach and was very clean and well designed.The toiletries were pretty average, and at $300 /night it's a bit overpriced for Bali, but it was a great holiday.I'll go back for sure. Some of the rooms up near reception are a long stroll to the pool and the action, which some guests might find annoying - request a pool end room if you want",Pelangi Bali Hotel
975,Pros & Cos,40,December 2011,"I travelled to Bali recently with my partner and stayed her for 6 nights.

Pros:

- Seminyak as a great location as it was out of the hustle and bustle of Kuta.
- Great waves for surfing
- One Free massage at resort
- Could watch sunset from pool
- Room very clean. Cleaners came each morning.
- Atms and supermarket close by ( with cheap beer and chocolate)
*** BIGGEST PLUS: when you walk out of the resort onto the beach just slightly to the right is an elderly women named Rosa who gives the most amazing massages! I payed I think $3 for half an hour for a full body massage! I went back everyday and sometimes twice a day! I ended up tipping her a lot she was so good! If i ever went back to bali I would go back to her.

Cons:
- American buffet breakfast looked great but tasted terriable.
- Booked white rafting at tour manager at hotel. We thought we had a great deal but then found out from other people we met on the day they had payed $10 cheaper. You just have to talk the tour man down.
- I tryed a lot of the mixed alcoholic drinks at the pool bar and didnt like any of them they must use cheap versions of vodka ect. However bintang makes up for it.

If i went back to Bali i would try somewhere different but cant complain of the accomodation",Pelangi Bali Hotel
976,"Relaxing, sensational beachfront location",50,May 2012,"Great reception at check in. Perfectly cleaned comfortable spacious room. Like most reviews here, no safe deposit box in room, but 24hr access at foyer. The view from the restaurant and pool area is amazing. Soooooo relaxing to see the activities on the beach from the pool lounge. Fabulous massages right on beach. Drinks in hotel a little pricey. Happy hour 4pm to 6pm, 30%off. Don't go past the Chiringuito restaurant directly out on the front. Fabulous service, recommend the tuna steak, best ever. All the staff are extremely helpful and so friendly at the hotel. Treat yourself to the honeymoon spa, it's amazing! Night life along the strip is great, if you are looking for a great fun night you can't go past the gay bars! Great staff, very friendly, great music and so much fun. We loved it so much we have booked to go again in October.",Pelangi Bali Hotel
977,Fantastic Experience!,50,March 2012,"We love this hotel. We stayed for a week in March, best time of the year, not to busy! We were met at the airport and taken to the hotel where our check in was quick and easy. Our hotel room was really nice with al;l that you need to be able to enjoy your stay. Staff were friendly and would go out of their way to assist you. The pool area is great and we really loved the pool area with the in pool bar, cocktails also were fantastic. The hotel grounds are well kept and the gardens are lovely. Highly recommend the Pelangi to all travellers. We will be going back next year!!!!
Some of the review photos are very outdated as the Pelangi has been renovated.",Pelangi Bali Hotel
978,Great hotel for those wishing amenities over price,40,May 2012,"There is nothing bad to say about this hotel. The price is a little expensive compared to some of the surrounding budget hotels, but you get what you pay for...

The hotel had a great pool and beach access. The staff was pleasant, friendly and available at all hours of the night. Check in/ Check out was a breeze, and the concierge was a terrific help with all of our needs... I think this hotel is best for those looking for a relaxed atmosphere and don't mind paying slightly more for quality.",Pelangi Bali Hotel
979,Nice hotel on the beach,40,May 2012,"My boyfriend and I enjoyed our 4 day, 3 nights stay at the Pelangi Hotel in Bali. We were promptly picked up at the airport by a friendly driver, and had a quick an efficient check-in.

The hotel itself was nice and cozy, with comfortable beds and plenty of space in our standard room. I really liked the hotel pool, as well as the buffet breakfast that was served at their restaurant overlooking the beach.

The hotel staff was pleasant and helped us with a smile at all hours of the day/night - even when we came back really late in the morning; they were prompt in giving us our hotel key.

The only inconvenience was that the rooms were not equipped with safe deposit boxes. So we had to place our valuables in a room with lockers next to the reception area - which had it's own manual system with two keys.

The location of the hotel was excellent. The hotel overlooks the beach and we could walk around Seminyak to all the clubs in the area (we were surprised that we were 10 mins away from the salsa clubs that we loved!) - including a 15-min walk away to Ku De Ta.

The hotel was a little pricey - we could've gotten much cheaper hotels in the area.",Pelangi Bali Hotel
980,Great bali holiday,50,April 2012,"Everything a hotel should be. Excellent staff, comfortable rooms, great pool and breakfast. Easy access to beach and a short walk to shops and resturants. Best kept secret in bali",Pelangi Bali Hotel
981,"""Great hotel will stay there again""",50,May 2012,"Amazing location right on the beach. The hotel staff are very friendly and the rooms are very clean. The hotel provides a free shuttle into Kuta at 9am, 11am, 1pm, 3pm and 5pm. Food was amazing and the drinks are reasonably priced. Breakfast was included with my accomodation and the resturant looks out over the ocean. The hotel staff also gave great tips regarding changing money - BMC highly recommended and to use the Bluebird taxi's. The hotel pool and swim up bar is extremely clean with plenty of lounges around the pool.",Pelangi Bali Hotel
982,Great hotel,50,April 2012,"Had a wonderful experience here after leaving Kuta in search of a better Bali experience. Amazing location (right on the beach), although you do need a cab to get into the restaurant/shopping area of Seminyak). Rooms very clean and service was SO GREAT. The staff there is amazingly friendly and for that reason I felt like I was staying at a 5 star hotel. Pool area is very nice and overall I would say great value for money. Also, great buffet breakfast.",Pelangi Bali Hotel
983,"Great value for money, if travelling solo stay closer to the restaurant strip",40,May 2012,"I was travelling with family and chose this hotel because it was right on the beach and was reasonably priced. The hotel is great value for money in terms of accommodation incl breakfast, the pool is great, the drinks were reasonably priced, and if you go out to the beach and turn left you can get to a mini mart and some restaurants easily. It's about 1km to the right along the beach to ku de ta - too far to walk in the heat through the streets (about 3kms via road) Food and services were quite expensive through the hotel, better to eat out for lunch and dinner. And contact a local laundry to get washing done for about 10% of the cost at the hotel. We used Aryas laundry who did pick up and drop off to hotel. Staff at the hotel were very friendly and nothing was too much trouble. If I was travelling alone I would have preferred to be closer to the main restaurant, bar and shopping area, but if in a group, this location is fine. Swim up bar in the pool is great for hot afternoons. Local tip: in case you get sick, you can buy antibiotics without a prescription from most chemists.",Pelangi Bali Hotel
984,Seminyak,30,March 2012,"Traveling as a couple, we stayed here in the first few days. This hotel was chosen for the excellent location, over the beach.
The staff is very helpful, the breakfast reasonable, fair room and bathroom, although everything shows its age. Anyway, for this price and location its a very good value.",Pelangi Bali Hotel
985,"Friendly, value for money, on the beach and close to shops and bars",40,April 2012,"In the past I've stayed in 5 star hotels in Bali but we got a cheap deal and decided why not. The rooms were clean, air-conditioning set to the perfect temperature and any time we ordered room service/a bucket of ice it arrived promptly. It is right on the beach and a close walk to many bars and restaurants. The breakfast was fine, it could be improved by varying the hot dishes daily.
The staff were really lovely and extremely helpful. I would definitely stay here again.",Pelangi Bali Hotel
986,Family friendly Hotel,30,March 2012,"I stayed with a group of adults recently. The majority of our group are seasoned Bali visitors. The hotel has a wonderful location. Not too far to the the local restaurants and markets.The pool is fab, although it would benefit from some shade sails over the pool itself. Rooms are comfortable, and well presented. Would have liked a safe in my room instead of a safety deposit box at reception. All the staff a wonderful, and happy to assist with any request. Because we were all adults we enjoyed the entertainment at the local nightclubs (Bottom's Up, etc) but be warned these are filled with cross-dressers and gays, all very loverly people and up for a good in-offesive time.There floor show's are truly amazing.",Pelangi Bali Hotel
987,Better Than Expected,40,March 2012,"We stayed 6 nights in March 2012. Pleasantly surprised as it was better than we anticipated. We would normally stay in a higher rated hotel but got a ridiculously cheap package and were prepared to compromise but it proved to be very good. Right on the beach with restaurants, massages and tour operators within one minute of the hotel. A short walk to a supermarket for supplies 'tho a slightly longer walk to the main street of Seminyak. Good, cheap shopping along the way and a bit further to Bintang Supermarketwhich has everything you require including great prices on souvenirs. Staff were very nice and helpful at all times and breakfast quite good. If you are on a budget don't hesitate to stay here.",Pelangi Bali Hotel
988,Absoulute Bliss,40,April 2012,"Dont go past staying at the Pelangi. I stayed in the Deluxe Room 301 over Easter and was pleasantly suprised, my friends called it the Presidential Suite as it was clean, modern and big. The hotel is located on the beach which is ideal for morning walks down the beach, many great restuarants and eateries and lots and lots of culture not to mention stalkers, but hey thats Bali. Pelangi is also located close to Seminyak with just a short walk around the corner. Lots and lots of fine resturants, boutiques and things to do.
I would definately stay at the Pelangi again and again.",Pelangi Bali Hotel
