,title,rating,date_of_stay,review,resort_name
0,"Great hotel, great location.",40,April 2023,"Spent a week here after 4 days in the country. Great hotel, check in was really quick. Very very spacious reception and a nice cool drink on arrival. We were given a room on the ground floor but I asked if we could have one on the first floor and they sorted this out immediately. The room was lovely, very clean and the bathroom was great, nice size and quite modern. Only thing is don’t rely on the hairdryer that they provide, not powerful at all. I had bad hair for the whole week but wasn’t bothered in the slightest.
The outside corridor going to our room was in need of a kick of paint. Breakfast was ok, choice of Balinese and English. Bacon was probably the worst we have ever had on holiday. Rooms were cleaned regularly.
The pool area was kept clean and staff tidied up constantly. There was quite a lot of adults drinking at the pool bar, but the pool is quite big so it wasn’t a problem.
The bar area is very poor, we didn’t see it open in the whole week we were there. It was very small with a few tables and chairs but not open.
We had a treatment in the spa which was average and overpriced, you can get a better deal in the many spas in the local area. You can however use the spa on your last day to have a shower etc..
The hotel is perfectly located and backs onto (almost) the beach. The beach is perfect during the day and the night is brilliant, great beach bars with plenty of multicoloured bean bags to relax in.
Would definitely recommend!",Pelangi Bali Hotel
1,"Pelangi Hotel Bali, Seminyak",40,March 2023,"We stayed in Pelangi Bali, Seminyak for a week and the stay was really comfortable. The staff were really friendly and service was really good. The place was clean and breakfast options were good too! In room dining options could have been better with more options. The room was comfy enough and maintained well. Overall, a good place to stay either as an individual or for a family for a short vacation as it's just very close to the beach and not pricy!",Pelangi Bali Hotel
2,fantastis,50,January 2023,"Awesome - right on the beach, great pool great food and close to all the restuarants
Within walking distance of the Bintang supermarket and walkable to Legian .The rooms are great and the staff super friendly . We will be back :):)",Pelangi Bali Hotel
3,Nice stay,40,March 2023,"The hotel looks very good and well-kept, very well located at just 1 minute from the beach. The rooms are spacious and clean, and the staff is very nice and kind. Varied breakfast and tasty food.
Overall, the quality-price ratio is very good.",Pelangi Bali Hotel
4,Amazing hotel,50,March 2023,"Great family friendly hotel with amazing staff. 2 good pools. Kids pool was shallow enough for 2 yr old to stand which was good. Both pools connect to swim up bar also.

Breakfast was good. Good selection of Indonesian, western and continental. No limit to how much you can eat.

Right on the beach and located to a vast amount of bars and restaurants.

Only negative is the room would fill with mosquitos daily. The hotel do provide some deterrent but reccomend buying some spray to kill them on site. Otherwise you will be chasing them round the name like I was.

Qn",Pelangi Bali Hotel
5,"Nice, comfortable experience.",40,January 2023,"Comfortable, clean, prompt. Conveniently placed for Seminyak top class eating joints, or shopping - 3.5 km by free hotel bus (@3pm everyday - pls pre book) to Seminyak Central or Kuta Market. Close to Agung Bali and Krisna Mall too for reasonable shopping.
Some friends enjoyed the clean and hygienic, very good spa and massage services.
Just outside the rear premises of hotel is a lovely beach, lots of shacks selling all kinds of cuisine. Wonderful place to relax, get a foot massage, or just chill! A little noisy tho. Some shacks have live music too!
Food not that great at this hotel. But, with so many eating joints walking distance from the hotel……food is not an issue. Breakfast was average.
Overall, happy with the hotel.",Pelangi Bali Hotel
6,Decent stay in a great location,40,December 2022,"Decent hotel in a fantastic location. Rooms are spotless, bed incredibly comfortable and the best shower I've ever had in my life. Great pool, sunbathing areas with an awesome sea and sunset view. Not so great breakfast buffet but adequate for the price, spa not really functional at time of stay (currently only offering massages, no sauna or jacuzzi).

Special thanks to Wiwik (front desk), Krishna (restaurant) and Andy (room attendant).",Pelangi Bali Hotel
7,DEPRESSING AND THE RECEPTION VERY HARD RULES VERY HARD. LOST KEY THEY WANT TO CHARGE YOU CAN IMAGINE.,20,December 2022,Too old hotel. Walking to the room the passage is terrible and the room are very depressing THE HOTEL RULES VERY HARD. DAUGHTER NOT WELL AND THEY ONLY GIVE ONE HOUR EXTENSION . We book ten room Better hotel like courtyard marriots just in the right place Harris hotel beautiful make you feel fresh. This hotel make you feel very depressing. Very quiet no people around the lobby,Pelangi Bali Hotel
8,We love Pelangi,40,November 2022,We love the position of the Pelangi hotel. It's right in the middle of everything and only steps to the beach. The breakfast is always good and plentiful. Staff are all friendly and the pool is beautiful. Very good shower since renovation. We would prefer bedside lamps to very bright spotlights in the ceiling. The downstairs room smelled of mould.,Pelangi Bali Hotel
9,Bali Family Fun,50,October 2022,"Would recommend this hotel. Spent 7 nights with adult children and grandchildren. Total group of 9. Staff were helpful and friendly, room was cleaned spotlessy every day. Loved it's location with beach outside plus restaurants and shops nearby. It's not a new hotel in fact it celebrated 21 years anniversary while we were there but it was lovely and we all had a wonderful time. Thank you Pelangi Hotel.",Pelangi Bali Hotel
10,Returned after a long absence. Still an amazing resort.,50,October 2022,"First time back to Bali in ages and several years since staying at the Pelangi.
Not disapointed again. Friendly staff, nice rooms and an easy going feeling.
It is a great central location as border of semyniak and Legian so shops, food, bars, beaches are all in easy reach.
Used the Hotel money changer as rate was same or slightly better than in the main street.

Booked a package and got a v ery nice romantic dinner along with a terrific massage on site.

Due to an error by me in AU, I booked an extra night in the big suite and WOW, it is huge! It is there most expensive option but wanted more than the one night there (as also had a very early plane out) However, our first few nights in the standard accomodation was also great.

Pool bar is always good to meet fellow travelers and breakfast was also relly nice.

It ticks so many boxes for ease, location and food/drink.

WIll be back.",Pelangi Bali Hotel
11,"Holiday in Paradise with everything you want, with shopping and eateries within walking distance. Lovely experience",50,October 2022,"Very nice rooms, the staff were great, easy to get along with and very friendly and helpful. The location was fabulous, with a lovely pool and right across the road to the beach. Plenty of variety for breakfast and a good menu for lunch and dinner. Would recommend. 👌😎",Pelangi Bali Hotel
12,Great hospitality,50,October 2022,"One word to sum up my experience in Pelangi Bali hotel-Seminyak: hospitable.

This four-star hotel has its own beach that simply satisfies one’s eyes with sunset view stretching along Seminyak beach.

Also this hotel is nicely located in Seminyak with adjacent various restaurants, cafes and stores.

The superior room is quite comfy with 2 large twin-sized beds
The swimming pool is near Rama restaurant and that gives advantage if one wants to directly dive into the pool after breakfast. 😃

I really enjoyed my stay @ Pelangi hotel, Seminyak Bali",Pelangi Bali Hotel
13,Terrible - They Don’t listen to Guests at all,10,September 2022,"I have travelled to 32 countries in my life and out of all of the places I have stayed, this has to be one of the worst handled hotels. I would highly recommend not staying at the Pelangi Bali Hotel In Seminyak.

Check in was smooth and lovely, room was quant and nice, however that was not the issue.

The issue is that I am currently on Holiday, and also working whilst on my trip. For the past two days, I have been staying at the Hotel by the pool, trying to get work and other issues that need my attention, done.

The Government has roadworks 20 Metres outside the pool area being constructed. The sound of steel and works is terrible, and I cannot focus at all or conduct any work or in other times, relaxation. I approached the manger, and she said that it was ‘not their fault’ and that they could not compensate me at all; free refreshments, upgraded room - nothing. I spoke with her for a great deal of time, and she sort no attempt to provide me with any help for my situation - instead, she insinuated that it was my fault and the ‘luck of the draw’.

Whilst I would happily conduct my work and relaxation from my room, the wifi is poor and unable to connect - with the only connection that is stable near the pool where construction is, or the hotel lobby. Neither these places are appropriate, as my employment is in regards to confidential information. In addition, I can also hear the noise of the construction from my room.

I would not recommend this hotel to anybody looking to relax, as the hotel goes against its word of providing a relaxing environment that comforts its guests.",Pelangi Bali Hotel
14,Need to Stay Here for Longer Next Time,50,August 2022,"I stayed here for 1 night (Friday) as a solo traveler before I left for the airport the next day (Saturday), and I wish I could have spent more time here. The entrance is so grand, it looks like a palace. In true fashion, the Bali hospitality was exceptional, and check-in was informative and fast. The hotel is really long, it’s quite funny. Everything leads into the courtyard which leads to the pool & restaurant at the end of the long hotel that’s right near the beach. Food was great - I ordered room service & also thought the breakfast buffet was varied. You can eat at the pool bar too, and the pool is oddly shaped but nice & large, and gets a bit deeper towards the end. The restaurant has plenty of space, there’s lots of places to lounge around the poo. I wish I could have tried the spa! Next time. They have half day & day rates available if your flight leaves @ night, like mine did. To extend my checkout to 6pm from the night prior would have cost around 900k IDR (~$61 USD). This is great for travelers with late flights, though! The neighborhood is quiet & clean which was a nice surprise, but lots of shopping, and lots of beach access. I will be back for a longer stay when I don’t want to stay in Canggu! ;)",Pelangi Bali Hotel
15,Nice hotel in good location,30,August 2022,"I did like Pelangi Hotel, as we got it for a very good price, but there are some things to be aware of. The staff are amazing, very friendly and helpful. The rooms are very basic but fairly clean and comfy. Felt a little dark and dreary with little natural light. The rooms and hotel are a little dated and could use some maintenance. Could hear noise from adjoining rooms. Breakfast was fairly standard fare, but was tasty and filled us up. Pool was lovely and was nice having a swim up bar. There were plenty of chairs and lounges, but a little further away from the pool overlooking the beach. Location was very good, nice and close to all the beach beanbag/umbrella restaurants.",Pelangi Bali Hotel
16,"A great, welcoming hotel",50,August 2022,"This is a great hotel. I was made to feel very comfortable here. The staff are friendly, the room was large and clean, and the pool is stunning - with a great poolbar and long cocktail list. It backs directly into Seminyak beach.

Would definitely recommend!",Pelangi Bali Hotel
17,Great Stay!,50,July 2022,I loved my stay at Pelangi. I would recommend it to others and stay again. The rooms are great and the pool/beachside area is excellent. The only two things to keep in mind - you’re at least a 20 min walk from the main town (we had to get taxis back and forth) AND the breakfast does not have many options for vegetarians (it’s quite a basic hotel breakfast).,Pelangi Bali Hotel
18,Beach Location,40,June 2022,"Older style hotel but very clean, great friendly staff, great beach location with plenty of bars and Restaurants on the beach, mini mart out the front and money exchange right on beach entrance. Rooms are great with walk in showers no bath, beds are very comfortable and A/c works well, unfortunately no verandahs for ground floor rooms. Breakfast needs more options there is a egg station but other choices are generally last nights left overs, bacon, cereal, fruit and toast. Plenty of restaurants and shopping close by, if you can get this Hotel for around $70pn its good value. All in all a great stay.",Pelangi Bali Hotel
19,Great spot,50,June 2022,"We stayed with 4 couples and our toddler end of May for 9 nights. We’ve stayed before so knew what to expect. The rooms were clean, bathrooms seemed to be renovated and the A/C was lovely. We picked this place because of the location - it’s on the beach, close to all the afternoon/evening entertainment on the beach and walking distance to anything although we did get the hotel to call us cabs if we went too far with the toddler/pram.
The breakfast was fine but we did go out to the beach bars to try something different and the swim up bar got a work out.
The value for money here is just perfect for a family holiday and we loved our stay.",Pelangi Bali Hotel
20,"Basic all round, average cleanliness, average service, read more below",30,May 2022,"I stayed here with 4 other friends, all with seperate rooms, for 4 nights. The hotel is in a pretty good location, right on the beach and easy walking distance to the beach bars, and up into Kuta if you want a decent walk.

The hotel itself is pretty basic and average all round. Breakfast was included in our room rate, but its nothing special, but fills the stomach. Don't expect over the top, but there is an eggs station which can get busy, some beans, toast, water, juice. Not bad if its included within your room, but i wouldn't pay extra for it.

The pool is alright, the layout of the pool is a little weird, but the pool bar is open daily, so thats a plus. There aren't too many sun beds kicking around the actual pool, but there are some facing the beach, although the water and sand down at the beach is dirty and needs a good clean.

The rooms are OK! Comfortable, and the aircon worked in my room. My friends had issues with their aircon and safes and the staff didn't fix the issue for them even asking several times to assist. One of my friends went without aircon and safe for his entire stay as staff just couldn't seem to work the issues out or were not interested in sorting it out, language barrier maybe?!

The shower was hit and miss, sometimes you'd get hot water, othertimes you'd have to wait for about 10mins with the water running for it to get slightly warm. During peak shower times, maybe around 8am when people are waking and showering the pressure can be low, rather annoying.

Every morning around 7:30/8ish you would hear the houes keeping trolley roaming around the hallways with its noisy wheels, so dont expect a sleep in! when moving furniture in nearby rooms this would also wake you up, or curtains which dont block out the sunshing in the mornings.

Overall if you can get this for under $50 AUD per night, maybe closer to 30/40 then its a bargain, but don't expect top notch service or food.

Thanks for the stay, my aircon worked, safe worked, and the room was fine for me.

2.5 stars for me, but 3 stars will do. Not sure i would stay here again unless it was $20/30 AUD a night, plenty of other places in bali.",Pelangi Bali Hotel
21,Theft of property by staff,10,February 2022,"I stayed for 4 nights and then moved close by to a villa. Once we arrived in the villa it was apparent that we had left behind an electronic equipment. I used it in my room at Pelangi and we don't have it in the villa.

I went back to the hotel two days after checking out and inspected my room (not occupied since we left), they checked lost property and with housekeeping. But did not have it

100% one of the housekeeping staff have kept this for themselves.

I sent an email asking for the General Managers contact details, but was not given any response.

I know times are tough in Bali at the moment - but theft is what it is, and the management culture that allowed it is wrong.",Pelangi Bali Hotel
22,Hotel closed for 1 month,10,June 2021,"Having 2 bookings for June..l was informed of closure for 1 month..l was then asked to pay much higher price to rebook on reopening.It would seem it is the best way to get extra payment from guests
Agoda not helping..nor is hotel
Ive asked for bookings to be honored at same price upon reopening...lm still waiting for replies from Hotel and Agoda
Not how Guests should be treated",Pelangi Bali Hotel
23,Lovely Hotel right on Double Six Beach,40,August 2019,"Clean, Friendly hotel right on the beach! Great location for lots of bar and restaurant options. Great selection of alcohol at the pool bar.

I can not fault the room, they are so clean and tidy and the staff are extremely friendly. Breakfast is incredible.",Pelangi Bali Hotel
24,loved our stay,50,October 2019,"had a lovely stay here at the Pelangi. We had 2 rooms that were joined, and the bedrooms were lovely. every thing that we needed for our stay was available. Breakfast was great, in fact probably the best we had in our 2 weeks holiday. Had room service a few times and ate dinner at the restraunt. Kids had a great time in the pool and we loved the swim up bar. Beach access was easy and the sunset is amazing.

My 2 girls loved there Pelangi bear that was left on the bed for them and still keep it on there beds at home now.

Also enjoyed a lovely spa treatment, and would love to come back again in our next visit",Pelangi Bali Hotel
25,Perfect!,40,October 2019,"Great location. Felt very safe in the area and it was easy to navigate being on the beach front. Lovely staff, restaurant and the spa were both great too! Room was clean affordable and perfect for our stay. Would visit again.",Pelangi Bali Hotel
26,Amazing Stay,50,March 2020,"This hotel is in the best location.
In between Seminyak and Legian, right on the beach.
Funky Bars on the beach right out the front for sunset and great restaurants close by.
The resort itself a little dated but has a great pool area with a swim up bar.
Rooms are very clean.
Breakfast was included which was a good choice of foods. We also ate in the restaurant and at the pool side which was reasonably price and food was nice.
Great for couples or families.
The staff were wonderful, helpful and friendly.
We would definitely come back to this place.",Pelangi Bali Hotel
27,Excellent,40,February 2020,"What a lovely hotel this is, the staff couldn't do enough to accommodate each guest. The hotel itself is very peaceful & relaxing, the rooms were extremely clean & the beds were very comfortable. The room had air conditioning, hair dryer, tea & coffee.

I tried some of the spa treatments which were definitely worth the cost & the staff at the spa were very professional & polite.

I also used the gym area with just one critism, the gym itself is quite a big space & it would be worth it for the hotel to invest in a rowing machine, pull up bar & some heavier dumbbells. The gym has air conditioning & music channel so it is a good place to work out.",Pelangi Bali Hotel
28,Hotel was OK - Older Style for Seminyak,40,February 2020,"Rooms were clean and tidy and staff were polite.
I wouldn’t rave over the place but it was OK. Food in the Restaurant was average. Breakfast was the standard Bali Smorgasbord.
Unfortunately forced to use local Transport - Bluebird can bring you to hotel but. Or get back in to pick you up

Location near the beach is great",Pelangi Bali Hotel
29,Great hotel,40,February 2020,"Stayed at the Pelangi recently and was pleasantly surprised after reading some earlier reviews. I found all the staff very friendly. The room was spotless and huge bed very comfortable. I would agree the bathroom could do with an update but this is minor. Location was fantastic, walk to La Plancha for drinks and bar food and to Gado Gado for amazing food and drinks. Spa treatments were wonderful.",Pelangi Bali Hotel
30,The Pelangi,50,February 2020,This is the 7th visit to Pelangi and once again thoroughly enjoyed it. Pelangi is so well located to the Seminyak area..Great Bars and Restaurants in walking distance also..Pelangi has a Fanastic Pool..Great Buffet breakfast..we usually dine out at Restaurants for dinner and enjoy a Club Sandwich at the Hotel Pool..Great Staff and Very Clean Rooms ...Look forward to coming back next year..,Pelangi Bali Hotel
31,Sharon weir,50,February 2020,This hotel is absolutely spotless the staff were so polite & friendly the room we had was a deluxe room with balcony which looked right onto the beach .The food in the restaurant was great & well presented 5⭐️ Service in this hotel will definitely be back thank you for a great holiday .,Pelangi Bali Hotel
32,Dirty and Dated,10,February 2020,"4*. Not a chance!
At best (and pushing it) it’s a 3*.
Staff were attentive on arrival. And that’s where it stopped..... room had an adjoining door which is not an issue, but I could hear everything from the next room.
Bathroom - my god...... 1970s.
Communal corridors were more youth hostel than 4*.
Pool was great and the location is good.
Checked in for 4 nights and checked out after the first. Prefer to lose money than stay there.",Pelangi Bali Hotel
33,Very average,20,January 2020,"Think again before staying here. Much better value for money can be found elsewhere! Hotel is tired and run down. Service is very average along with very average breakfasts. Rooms are way past their due by dates . We swapped to the suite overlooking the pool which made it a little better but still not great and the only reason I’ve given it two stars. The rooms are clean however this does not extend to the whole complex. Everywhere else you go staff are falling over themselves to serve you, at the Pelangi they are standing around staring into nowhere. I think they’ve even given up on the place.",Pelangi Bali Hotel
34,Not for the elderly or immobile,30,January 2020,"The photos are generally better than reality. This was a case in point. Lots of stairs to get to reception and then stairs down to our room. The foyer stairs had been fitted with a ramp, but not the stairs down to the ground floor rooms. Not a lift in sight! Theroom itself was spacious with a roomy bathroom. Water was perhaps the hardest I have experienced in Bali and the soap would not lather. That meant showering using shower gel, but with no faceclothes provided you quickly ran out of shower gel. Breakfast as included but was fairly nondescript. Bacon was provided, a possible bonus in Indonesia, but was perhaps the worst bacon I have tasted. There were plenty of bars, restaurants and massage places within walking distance but they appeared to be more pricey than my previous stay in Sanur. On the last evening we had dinner on the rooftop terrace to view the sunset. Dinner was a disappointment; a Balinese chicken curry that lacked in flavour and clearly has not had the chicken cooked in it, and a grilled chicken, which was exactly that, but dry and tasteless. Fortunately the pricing was not over the top. We did enjoy the sunset. Needless to say Circle K convenience store across the street provided the dessert. The hotel is clean and comfortable, but certainly not for the elderly or immobile.",Pelangi Bali Hotel
35,We loved this hotel!,50,January 2020,"The hotel is a traditional balinese style hotel. It has a beautiful spa and pool . You just walk from the hotel directly onto to the beach ( 30 m) and are also within easy walk of the local shops.
The food is varied for all tastes and we found that if you had a specific request they would go out of their way to provide . The staff are all very welcoming and helpful, Whenever we asked for anything it was sorted quickly and efficiently.
We went to the spa and found the staff to be very professional and provide a good service in a beautiful environment , and although a little more expensive then out in the many massage parlours available in the shopping area, the whole experience with music and surroundings was lovely.
There is a shuttle bus which can take guests for free to local towns and areas. Also a very helpful travel /tour section in reception.
We have a large room with air con , tea/coffee, fridge , safe and enough space for clothing as well as aTV . Nice big bed too. Housekeeping staff lovely and every day made up the room beautifully and always smiling.
Every night we have watched the sunset from the beach and tonight from the roof terrace at the hotel which was magical.
We have loved staying here and would recommend to anyone .

I",Pelangi Bali Hotel
36,The MOST DISGUSTING HOTEL IN SEMINYAK!!,10,January 2020,"The hotel is terrible, terrible and even more terrible!!! Hotel facilities very poor; the food at the restuarant very poor, the hotel staff ok however there was a rude lady at reception which was totally unnecessary! A total RIP OFF, VERY SEEDY and NOT THAT SAFE!!! Never again!",Pelangi Bali Hotel
