,title,rating,date_of_stay,review,resort_name
333,Return visit,50,September 2016,"This hotel is amazing. This is our second visit & without a doubt we will be back again. Amazing hotel. The staff here I believe to be world class, they've just renovated some of the rooms & the they are fantastic. We stayed here last time on our honeymoon & have returned with our 6month old after a disappointing stay at another hotel. We check out early from the other one & came straight back here.",Pelangi Bali Hotel
334,For $80 - max $100 a good place in Seminyak,30,September 2016,"Spent 2 nights at this older, a lil worndown almost beachfront hotel in Bali. Rooms comfortable, clean large bathrooms, nice pool and decent restaurant. Close to the 'main street' with nightlife and shopping. I overpaid, Australian holidays, but if you get a rate around $80 with b- fast is a decent place to stay. Fun restaurants / bars on beach right bext door.",Pelangi Bali Hotel
335,Mrs,50,September 2016,"Great hotel, great location, great staff, good buffet breakfasts, good restaurant, pool is great, rooms great, decor of rooms and lobby and pool area fantastic, the hotel massage and spa has private rooms for you to be totally relaxed and at ease, the only thing they need is an elevator, would recommend this hotel to other travellers.",Pelangi Bali Hotel
336,Perfect on the Beach,50,September 2016,"We stayed (as a couple) for our last two nights in Bali - wanting that ""beach"" access. On arrival, we were impressed with the overall ""look"" of the hotel and access for baggage. Check in was smooth and we were shown to our upper floor room - which was perfectly adequate. The sheets were bright white and starched beautifully, and the bathroom was clean - although there wasn't really any room to store your toiletries. The hotel provided free WIFI and a mini-bar fridge, and also coffee/tea making facilities. The wee balcony was ""just that""... but fine. Proximity to the pool and restaurant was great and just a stone's throw from the hotel was a lane which you crossed - and there was the beach. Heaven in paradise! The hotel pool is sectioned into three parts - children's area, swim-up bar and then a two metre deep end. There were plenty of lounges with great cushions and the pool towel cabana had a check in/out system operating.

Our breakfast was included with our stay.. and it was substantial with hot dishes, egg station, pastries/toast/condiments and gorgeous ""ginger"" tea.

We loved our stay, great staff and very friendly ""vendors"" right by the beach. It was beautiful and we will come back again.

PS: There's a shop across the road where you can purchase beer/coke, snacks for your room! Hotel also provides a transfer to airport if needed - negotiate!!",Pelangi Bali Hotel
337,Absolutely Fantastic!!!!,50,August 2016,"We stayed at Pelangi Resort in August for 10 days and it was fabulous! The staff are incredible, nothing is ever a problem and always happy to help. Rooms were a good size, hardly in them though. I can't wait to come back next time!!",Pelangi Bali Hotel
338,Nice place on beach front,40,September 2016,Hotel is quite adequate in this area of Bali the rooms are a bit dated but still ok. The pool area is nice but the lounge hogs are fully on display especially from those at an age who should know better! So get in early and if you go for lunch or a massage give up your seat to a fellow holidayer 🤗,Pelangi Bali Hotel
339,"Great location, beautiful staff but hotel is antiquated",30,September 2016,"We stayed here purely for the location. It's quite central to most things and is off the main streets. We stayed for 6 nights with breakfast included. The pool area was nice and has areas for both adults (deep end & bar) and children (shallow area this is sectioned off). The hotel is the upper end of average pricing per night. It really needs some maintenance and a little updating and it could be amazing.

Pros:
The hotel is in a great location.
The breakfasts is standard but nice (it has an egg station and not a lot of choice for vegetarians).
The a/c in the rooms is quite cool.
The beach is directly access the lane and you can watch the waves crashing down at breakfast.
The staff are lovely and very helpful.
The rooms were always served promptly and looked nice.
The beds are firm but I like a firm bed.

Cons:
The hotel/rooms are very antiquated and in need of some renovations.
Our bathroom had mould and always smelt of bleach.
The towels were often stained and looked like they hadn't been washed (however, they had been).
The pillows were very high and hard.
The wireless is pretty slow and frustrating as it can drop in and out.",Pelangi Bali Hotel
340,Just a perfect place to be:,50,August 2016,"This hotel is not a 5 star, but the staff and presentation of this wonderful place certainly is, if you are thinking about a relaxed and special holiday in the beautiful island of Bali, then you should look at this hotel for your stay..Wonderful people and a perfect place to be:
Enjoy the atmosphere of the Indonesian Island.
Thank you to all the staff for making our stay just that bit more special:",Pelangi Bali Hotel
341,Nice hotel in a good location,40,September 2016,"Stayed at the Pelangi for one night to catch the sunset on Seminyak beach which was beautiful.

The hotel is nice and the staff are friendly and helpful.

The room is a nice size and you have all you need but the balconies on the second floor are pretty small.

Lovely pool area and access to the beach at the back of the hotel.

Breakfast had a nice selection and plenty of spaces to sit, so all in all a great hotel.",Pelangi Bali Hotel
342,Back to Pelangi Bali,50,August 2016,"Had another wonderful week at Pelangi Bali Hotel last month. Since leaving in April all I could think about was when I'd be going back again (I've stayed there many times before) then there was an airfare special too good to miss so I booked & went again in August. The week was fantastic, as always, and I've already booked again for next year. Everything about Pelangi Bali Hotel represents my perfect Bali holiday, it's just the best! 😊",Pelangi Bali Hotel
343,Cute little Resort right on the beach in Seminyak,40,March 2016,"The rooms are clean and tidy but small.... BUT luckily you dont really spend much time in them. Great location, right across from the beach. The beach is a must see/do at night. So many places to sit and have dinner and drinks and listen to live music. One of my favourite things to do while in Seminyak. The resort has a great pool that overlooks the ocean. Not the cheapest place but not expensive. Still Aussie priced drinks. Don't recommend girls walking home alone at night in the area. In the streets or even to rooms after getting out of a taxi.
The verandah on the room is so tiny one person can sit out there.",Pelangi Bali Hotel
344,Not as it seemd,30,May 2016,"My first impression of the hotel online looked great, sadly it didn't when we arrived. there was no greenery at the front ? the reception area is very large but not a lot of staff. But the staff we saw and talked with were very helpful when needed. The room was big enough, but need to add some drawers or side bed cuboards to put things on.
There a tiny space outside the room for table and chairs, which are in the room and wouldn't fit outside space is small. Didnt realy see much of the chamber men/women, They were very young, I was wondering why it took 4/5 of them to do one room ? were Food hall I shall call it, well I only had breakfast and one snack. the breakfast (Bacon) I know it said crspy, but it looked as though it had died a slow death like yesterday. so disappointed I was even told I couldn't have milk in a jug for morning coffee ? so I helped myself to milk for cereal. The décor is disgusting it looks like it was decorated in the 50s. Lamps for ceining lights need replacing, infact the whole eating area could do with an overhall. The staff weren't friendly or helpful at all. They didn't smile stood about chatting to eachother. A smile goes along way and doesn't cost a penny. No wonder why breakfast time was the busiest.I may have seen 3 people eat there at any othertime.
The swimming pool was ok, although the step that goes across is abit dangerous for someone who is blind. There wasn't enough loungers or umbrellas for those who needed one. what I didn't understand , the guy packed the umberellas away when it rained? WHY ?
THERE IS A PART OF THE POOL AREA AT THE BACK OF THE HOTEL NEAR THE EXIT TO THE BEACH. I NOTICED THAT THERE ARE SUNLOUNGERS RIGHT NEAR A LONG DROP INTO SOME KIND OF WORKS PLACE BELOW. IT IS DEFINATLY NOT SAFE AND WILL EITHER KILL SOMEONE OR SERIOUSLY INJURE SOMEONE. PLEASE MANAGER YOU REALY NEED TO FENCE IT OFF AT A HEIGHT THAT ISNT A THREAT TO YOUR GUESTS OR ANYONE ELSE....
YOU HAVE FENCE AROUND SOMETHING AT THE OPPERSITE END OF THE POOL..
SO when you go to the back of the hotel towards the beach, which is just literly there.
But what we didn't know was the is a small road which motor bikes use all the time. and in the dark its no fun. we managed to find ourway back to the hotel the back way. very dark and to be honest I didn't see any form of light to show the steps up to back of hotel, and we didn't notice any security. We could have been anyone coming in.. scary thought.
yes the front of the hotel just as it says front its a front. which isn't that bad. but to be honest If you stay here for a couple of days thatd be fine but I wouldn't stay here for a week again. even though recep staff were gud that's all that was. please it needs a big total refurb, its in a prime spot for windsurfing mixin with the locals, meet like to like people. with the strip round the corner plenty places to have a bev and chingwag. very busy... ,",Pelangi Bali Hotel
345,Loved it!!!!,50,August 2016,"My husband and I stayed 5 nights here for our honeymoon. We absolutely loved it, the staff were so welcoming and friendly. We're now staying in Swiss Bell Hotel in Tuban and would prefer to be back at Pelangi!! Thank you so much to the team at Pelangi and especially Agus, he was so helpful! We will be back next year A++++",Pelangi Bali Hotel
346,Good all rounder,40,August 2016,"As mentioned in my last, I have returned. Little has change but some rooms have had a face lift, I stayed in a re-furbed room with a bed so large you would need to phone your partner on the other side. Some of the more friendly staff remembered me by name but this time around I experienced some 'attitude' from some others- which took the edge off desire to love the place as I did before. As a result I will not be returning this trip as I had planned, deciding to explore elsewhere.

Regardless of this, I think this place is a great ""all rounder"" and I will certainly give it consideration when I return to Bali after Christmas.

If your a honeymooner or cementing a new relationship, be wary of the rooms with an adjoining door (family room). You can hear every sound next door so you may very well entertain (or annoy) the oldies in the room next to you.",Pelangi Bali Hotel
347,Great location!,40,August 2016,"The location of this hotel won me over... This is my second stay & I would happily come again. The rooms are simple, not amazing but ok when you consider the location which is excellent on the beach, quiet yet central & the pool & restaurant (nice food) overlook the beach! I wouldn't pay any more than $150 AUD per night but at this rate it's rightly priced for location. Most beachfront hotels charge much higher rates.",Pelangi Bali Hotel
348,Nice view,30,April 2016,"I have just walked by and tried their restaurant. The view is nice, their restaurant is facing the beach but not too close. The food was good but not too excellent. the staff was welcoming and warming.",Pelangi Bali Hotel
349,Great spot but getting a little tired !,40,August 2016,"The perfect location ,wonderfull staff but needs a little paint here and there mainly in dining area. Pool area also in need of love ! But a great pool none the less Rooms are comfortable and would stay there again .One thing that puzzles me is that TripAdvisor has been advertising this resort fron $86 ! All the times I have tried it's been double that ,so I would like confirmation of when this rate applies ?",Pelangi Bali Hotel
350,Perfect break,50,August 2016,"I loved staying at Pelangi for my whole trip. Me and my friend stayed there for 12 nights. The staff were fantastic and the amenities were great also.
Was also a good location as it was close to everything.
I would recommend this hotel to everyone and know they will not be disappointed.
I will definitely be back ;)",Pelangi Bali Hotel
351,I will be back next year!,50,August 2016,"Friendly, helpful staff. Breakfast buffet was awesome with a variety of food (eggs anyway you want it, Indonesian and European food, fruit, yoghurt, toast etc). Superior room was big enough. Bathroom and water pressure was good. Pool and restaurant is great, enough space for everyone (never too busy). Beach is so close. There is so many bars, restaurant and entertainment on the beach, everywhere. New mini mart built as we arrived across the road. I will be back again.",Pelangi Bali Hotel
352,Ideal Location,40,August 2016,"On first arrival at the hotel, it was very late at night and I was tired after a long journey so I wasn't too impressed with the decor. However, I must say in the morning after I rested, I was very impressed. The room was lovely with plenty of space, the bathroom spotless. The pool is great and I really liked the fact that no-one was putting towels to reserve places and I never had trouble finding a good spot by the pool. Just across the road is the ocean with great views. The upstairs restaurant served excellent food and all in all, I would say this is a great hotel in a great location with excellent staff",Pelangi Bali Hotel
353,Nice and close to the beach,30,August 2016,"The hotel was nice and clean - maybe a bit dated. The pool, sun-area and restaurant is a bit tight or small...There were not enough sun-chairs and the sun was gone for the majority of the area at four o'clock in the afternoon.

Attended balinesian evening with dancing and food - only 5 table attended and the
dansing was quiq and had no live music. But the food was very nice and portions generous.

Location was very good - only one step away from the beach and several beachclubs with amazing atmosphere, serving nice food and drinks and offering live music from four to ten o'clock. It was a bit hard to go swiming die to heavy waves and currents.But a lot of opportunities to go surfing and get cheep massages! Massages at the hotell is a rip off - do not book there!",Pelangi Bali Hotel
354,Back to the Pelangi again!!,50,July 2016,"This hotel calls us back each year!! I was a bit worried that we had booked a superior room this time, because in the past we had the deluxe room. But we found the newly redecorated room to be very nice indeed. The room was large enough for our requirements, and also the bathroom was fine, with great water pressure in the shower. It also had a very comfortable pillow top bed which was a new addition. The pillows were were a bit hard though.
The breakfast is always good at the Pelangi, they have everything you could want and the food is hot.
All the staff are always friendly and helpful at the Pelangi, and remember us each time we come back.
The gardens are very well kept and truly beautiful, they are the work of Ketut who works hard every day, and always loves to show off his garden. He is very proud of it.
We stayed at three different hotels this year, but Pelangi wins for the best breakfast.
We will be back!!",Pelangi Bali Hotel
355,friendly staff shared us much info about Bali,50,August 2016,"Kadek the receptionist was so friendly,he tell is a lot about Bali and the room in Orlando hotel was clean, just the breakfast is not suite for us. But the location is good and the beach side was the same as the advertiser on.",Pelangi Bali Hotel
356,Wonderful hotel,50,August 2016,I am usually very critical of where i stay but can't fault this hotel! Two thumbs up. Everything was done with efficiency and friendliness. There was a shortage of teaspoons at breakfast for our coffee and tissues instead of paper napkins but that's little quirks we joke about. I got a surprise cake in my room far my birthday!,Pelangi Bali Hotel
357,"Good location,nice staff, but the hotel is getting shabby",30,August 2016,"The rooms are clean and the staff friendly, but the breakfast is below average and the coffee awful.The hotel is very tradional balinese, which is really nice, but it is getting very shabby. The hotel has a very flat atmosphere and the restaurant staff are not attentive.On the upside the hotel is in a good location close to some great cafes and restaurants.",Pelangi Bali Hotel
358,Cute little hotel,50,July 2016,"Me and my partner stayed here for 3 nights. Im shocked at the tripadvisor reviews for this hotel as we really liked it. It is on a long narrow piece of land and the balconies are small with a ground walkway that has flowers and trees and is pretty. The staff are friendly and polite always saying hello. People do reserve sun loungers early but we didn't have a problem getting them up until 9am. The pool area is nice with a little swim up bar. We didn't encounter problems with people smoking by the pool or restaurant. Breakfast is good enough, fried food, fruit, Danish etc. The beach is over the road and at night the bars and restaurants put bean bags on the beach where you can sit and have cocktails etc we would stay again for a few nights definitely.",Pelangi Bali Hotel
359,"Friendly Staff, but disappointing hotel and buffet breakfast. Nice SUITE room",20,July 2016,"Although the hotel is fairly clean with friendly service, this was a disappointing experience. There are better hotels in Bali, Seminyak we have stayed before. Unfortunately this is an old hotel, very long corridors, tall concrete walls. The entrance to this hotel is very dark.

We stayed in the Suite Room (this is the ONLY room with an ocean view). The suite room itself was spectacular and spacious and just like the photos advertised on their website.

The other rooms look fairly average from the outside. The breakfast limited in variety, and food was dry.",Pelangi Bali Hotel
360,Mixed Feelings,40,August 2016,"We have stayed at Pelangi Bali over several years and have loved it and given it perfect reviews. The hotel and staff are still fabulous, they are friendly and helpful and the amenities and location are perfect. Breakfast is great, pool bar and towels are great, rooms are clean and everything works. BUT..has Kuta reached Seminyak or were we just unlucky with our stay as the guests were very different from previous years. The guests around the pool and restaurant were generally obese, tattooed, smoking, drunk and loud Australians the whole time we were there. They arrived at the pool bar each day and drank all afternoon until one even vomited and could hardly walk. Some of you may read this review and think we are snobs but we choose not to associate with these people at home on the Gold Coast and we don't want to be with them on holiday either. We love authentic places like Pelangi Bali, we don't like big sterile 5 star hotels.We like the shops, the massages and lively bustle around Seminyak but I fear we may have to look at other places in Bali like Sanur or Ulawatu for future years.",Pelangi Bali Hotel
361,Staff friendly,40,July 2016,Great place to stay location was excellent next to the beach plenty of restaurants close by and staff were very friendly pool was clean rooms were getting very old but still clean but are in the process of refurbishing recommend place to stay,Pelangi Bali Hotel
362,OK for those on a budget,20,August 2016,"I agree 100% with PygmyLeader. This is an OK hotel for the price and location, but it's not for those seeking quality accommodation and a Bali experience.

The reserving of sun lounges around the pool, principally by people in their 50s and 60s who should know better, was rude and inconsiderate, and the practice should be firmly dealt with by pool staff. It was also extremely disappointing that smoking was permitted close to the breakfast area and around the pool. Non-smokers find second-hand smoke obnoxious and paying guests should not have to suffer it.

I agree that the breakfast could have shown a little more imagination, but it was perfectly fine for the price. Tip: Avoid the Danish pastries, which IMHO would make very effective road base! Fabulous coffee.

The room exceeded my expectations, but I agree that the general maintenance and cleaning could be improved. The hotel has quite a shabby, 1970s feel to it. There is no garden to speak of, and the pool area is a concrete wasteland. Those who say the Pelangi pool is great should check out what $215/night gets you at the Royal Beach, 500 metres north along the beach.

We were not thrilled with the one meal we had at the hotel (apart from breakfast) so we ate out every day. The cheap and cheerful Cendana cafe near the entrance to the Royal Beach Resort is highly recommended, as is Poppies Restaurant near Bemo corner, Kuta.

As always in Bali, the staff were great, very obliging and accommodating.

People may not be aware of it, but in the past year or so the beach from north Seminyak all the way to Kuta is turned over at night to beach eating/drinking with different live and recorded music offered every 100 metres or so. The crowds were unbelievable and it was great fun. It all seemed to shut down around 11.00 pm, so noise was not a problem. Be aware that the food is indifferent, and you will pay more for a beer on the bean bags than you would at a sit-down restaurant.

The Pelangi is fine for those on a budget who nonetheless want to be in the thick of the action. However, if you are from that demographic that has become acquainted with the better things in life, the Pelangi may not be for you.",Pelangi Bali Hotel
363,Good Location..,30,August 2016,"This is about the 8th time I have stayed at the Pelangi Hotel. I love the location of this hotel, as it is on the beach, easy to walk to legian for shopping, seminyak for good restaurant's and has the funky little beach bars out the front of the hotel which offer reasonable food at night with live music. This time I had a 2 hour stone massage treatment in the day spa which was excellent, very professional service in a great part of the hotel that is quiet. The masseuse was outstanding. I had just come from a resort in Levina that had an amazing out of this world day spa, and this was on par with that. I was impressed! The pool bar is fun, a little slow. Breakfast is nothing special, so usually eat out from the hotel. All the staff are friendly and accommodating to your needs, so I believe that this hotel is value for money.",Pelangi Bali Hotel
364,All about the location!,40,July 2016,"A peaceful and comfortable hotel located right on the heart of the Seminyak beach close to La Plancha and all the beanbag beach huts to eat and drink. My room was a great size with a big comfy bed, breakfast had a great choice and the staff were pleasant.",Pelangi Bali Hotel
